absolwenci# Akademia wykształciła ponad 170 000 inżynierów i magistrów zapewniając kadrę dla naszej gospodarki. Wykształcenie, które zdobyć można w naszej Akademii, jest bardzo cenione przez pracodawców - zarówno w kraju, jak i za granicą. Błyskotliwe kariery wielu absolwentów AGH, związane z piastowaniem przez nich wszelkich, w tym także bardzo często najwyższych stanowisk, stanowią łatwy do prześledzenia praktyczny dowód jakości i użyteczności wiedzy, jaką zdobyli oni w murach AGH.
aktualności# Akademia Górniczo-Hutnicza im. Stanisława Staszica w Krakowie w roku 2019 obchodzi 100-lecie otwarcia uczelni. Wspaniały Jubileusz rozpoczęliśmy 4 października 2018 r. Inauguracją 100. Roku Akademickiego, a jego kulminacją będą uroczystości w październiku 2019 r.
uczelnią#multimedia# Akademia Górniczo-Hutnicza to ponad 100-letnia historia edukacji, badań i nauk technicznych. Teraz można ją lepiej poznać dzięki galeriom, filmom oraz wydawnictwom informacyjnym.
uczelnią# AGH jest nowoczesnym uniwersytetem technicznym, który aktywnie uczestniczy w budowaniu społeczeństwa opartego na wiedzy i wykorzystywaniu technologii na rzecz rozwoju i wzrostu gospodarczego. Uczelnia została powołana w 1913 r., a jej otwarcie nastąpiło w 1919 r.  Akademia Górniczo-Hutnicza jest nowoczesną Uczelnią publiczną o zasięgu ogólnopolskim, rozwijającą partnerską współpracę z uczelniami Europy i świata. Akademia Górniczo-Hutnicza jest uniwersytetem technicznym, w którym nauki ścisłe mają bardzo silną reprezentację i stanowią podstawę rozwoju maksymalnie szerokiego spektrum nauk stosowanych oraz stopniowo wzrastającej roli nauk humanistycznych. Zgodnie ze światowymi trendami rozwoju tworzymy nowe kierunki kształcenia, ale zachowujemy klasyczne, niezbędne do prawidłowego rozwoju nauki, techniki oraz gospodarki naszego kraju...
uczelnią#agh#w#liczbach# Liczba prowadzonych kierunków i specjalności:    
współpraca#oferta#dla#biznesu# Transfer, ochrona i promocja wyników badań, wynalazków oraz patentów: Umowy oraz porozumienia z przemysłem, administracją oraz innymi instytucjami. Pośrednictwo w pozyskiwaniu oraz kojarzeniu podmiotów. Budowa spółek, coaching, mentoring: Jednostka zajmująca się współpracą z przedsiębiorcami i przemysłem w zakresie polityki zatrudniania studentów i absolwentów AGH:  AGH oferuje ponad 100 kierunków studiów podyplomowych i kursów dokształcających, skierowanych zarówno do specjalistów kadry inżynierskiej, jak również do osób, które są zainteresowane zdobyciem nowej specjalizacji.
kształcenie# AGH kształci na wszystkich rodzajach studiów: stacjonarnych, niestacjonarnych, doktoranckich i podyplomowych, oferując szeroki profil kształcenia dostosowany do pojawiających się trendów na rynku pracy. Od roku akademickiego 2007/2008 Akademia Górniczo-Hutnicza wprowadziła trzystopniowy system kształcenia (tzw. System Boloński): W związku z reformą szkolnictwa wyższego, zainicjowaną wejściem w życie ustawy z dnia 20 lipca 2018 r. „Prawo o szkolnictwie wyższym i nauce”, AGH intensywnie pracuje nad dostosowaniem dotychczasowych przepisów dotyczących rekrutacji na studia wyższe do nowego prawa. Zachęcamy do regularnego odwiedzania strony Rekrutacja zimowa na studia II stopnia odbędzie się według dotychczasowych zasad określonych w uchwałach senatu i zarządzeniach rektora.
kształcenie#oferta#kształcenia#studia#podyplomowe#kursy#dokształcające#i#szkolenia# W AGH oferowanych jest ok. 100 kierunków studiów podyplomowych, a także kilkadziesiąt szkoleń i kursów dokształcających skierowanych zarówno do specjalistów kadry inżynierskiej (studia z dziedziny  ceramiki, elektrotechniki, energetyki, gazownictwa, geofizyki, górnictwa, informatyki, telekomunikacji, metalurgii, robotyki, telekomunikacji oraz inżynierii finansowej), jak również do osób, które są zainteresowane zdobyciem nowej specjalizacji, m.in. w dziedzinie marketingu internetowego, informatyki i grafiki komputerowej, ochrony środowiska, rachunkowości i controllingu, BHP, szacowania i zarządzania nieruchomościami, zarządzania projektami, przedsiębiorstwem, organizacją IT, zarządzania jakością oraz zarządzania sprzedażą. Nowy i niezwykle interesujący element oferty stanowią studia podyplomowe z dziedziny kreowania wizerunku firm, kreowania wizerunku osób, zarządzania talentami , projektowania produktu, a także  z dziedziny komunikacji społecznej i social mediów. mgr inż. Katarzyna Brzozowska
kształcenie#oferta#kształcenia#e#materiały# W swojej ofercie AGH posiada e-materiały:  E-materiały AGH są dostępne bezpłatnie, na licencjach Creative Commons, dzięki czemu ich wykorzystanie nie ogranicza się jedynie do czytania, pobierania czy drukowania. Każdy może dowolnie modyfikować zasoby, układać nowe e-podręczniki czy adaptować ich zawartość, dostosowując tym samym do własnych celów i potrzeb kształcenia.  Dla pracowników i doktorantów AGH, Centrum e-Learningu oferuje szkolenia na temat budowania i pisania e-podręczników oraz korzystania z Otwartych Zasobów Edukacyjnych w dydaktyce akademickiej. 
dla#mediów# Zapraszamy do zapoznania się z najnowszymi informacjami prasowymi na temat wydarzeń i projektów naukowych realizowanych w AGH:   - 1. miejsce w konkursie PROMYKI 2018 - Nagroda im. Andrzeja Sołtysiaka w kategorii „Działania promocyjne i komunikacyjne prowadzone w obszarze Nowych Mediów”.   Zapraszamy do obserwowania naszych kanałów w mediach społecznościowych. Biuro Prasowe AGH       Rzecznik Prasowy AGH +48 12 617 25 45  Specjalista ds. Social Media Specjalista ds. PR          
uczelnią#kontakt# Informacja o numerach telefonów (czynny przez cały rok w godz. 9.00-15.00)  E:  T: +48 12 617 32 61 T: +48 12 617 48 95 T: +48 12 617 32 81 T: +48 12 617 31 57 E:  E:  Dział Informacji i Promocji T: +48 12 617 31 91  T +48 12 617 49 38 T: +48 12 617 48 97 T: +48 12 617 35 41 mgr Anna Żmuda-Muszyńska T: +48 12 617 25 45  T: +48 12 617 49 60 T: +48 12 617 49 22 T: +48 12 617 53 25 al. Mickiewicza 30
polityką#obsługi#plików#cookies#" Przepisy art. 173 ustawy „ Prawo telekomunikacyjne"" obowiązujące od 22 marca 2013 roku zobowiązują do poinformowania o możliwości rezygnacji z zapisywania danych w plikach przeglądarki. Korzystając z  serwisu, aplikacji i stron internetowych Akademii Górniczo-Hutniczej wyrażasz zgodę na używanie ciasteczek zgodnie z polityką ciasteczek. W przypadku braku zgody należy zmienić ustawienia przeglądarki zgodnie z zaleceniami producenta lub zrezygnować z korzystania ze stron AGH. Ciasteczka (ang. Cookies) to pliki tworzone i zapisywane na urządzeniu końcowym Użytkownika podczas odwiedzania stron w internecie. Pliki zawierają informację pozwalającą zidentyfikować urządzenie Użytkownika w celu prawidłowego wyświetlania strony. Pliki najczęściej zawierają informację odnośnie pochodzenia (nazwa strony internetowej), czas (długość życia) ciasteczka, identyfikator przeglądarki, ew. unikalny numer tworzony na potrzeby sesji użytkownika. Podstawowym celem jest dostosowanie zawartości strony internetowej zgodnie z preferencjami Użytkownika oraz szybkości (optymalnego używania) korzystania ze strony. Pozwalają również zbierać anonimowe, zagregowane statystyki, które informują, w jaki sposób Użytkownicy korzystają z naszych stron, co pomaga ulepszać zakres informacji oraz sposób jej wyświetlania, ale bez identyfikacji Użytkownika. Do prawidłowego używania stron tworzone są i wykorzystywane pliki sesyjne oraz pliki stałe. Pliki sesyjne są plikami tymczasowymi, przechowywanymi na urządzeniu końcowym Użytkownika do czasu wylogowania się ze strony internetowej lub zamknięcia przeglądarki internetowej. Pliki stałe pozostają na urządzeniu końcowym Użytkownika przez czas zgodny z ustawieniami w pliku. Plik stały może być usunięty wcześniej z przeglądarki internetowej przez Użytkownika.  Użytkownik może zablokować pobieranie ciasteczek w ustawieniach przeglądarki:"
współpraca# W AGH od roku 2011 działa Centrum Międzynarodowej Promocji Technologii i Edukacji AGH-UNESCO, które jest pierwszą w Polsce jednostką pod auspicjami UNESCO, inspirującą i koordynującą oraz wspierającą wymianę i transfer wiedzy i praktyki inżynierskiej oraz kształcenie na poziomie uniwersyteckim w dziedzinie nauk technicznych w wymiarze międzynarodowym, zwłaszcza adresowanym do krajów rozwijających się. Działania Centrum AGH-UNESCO wpisują się w priorytety UNESCO oraz AGH i są adresowane do partnerów na całym świecie.
biuletyn#informacji#publicznej# Biuletyn Informacji Publicznej to urzędowy publikator teleinformatyczny, składający się z ujednoliconego systemu stron w sieci informatycznej. BIP został stworzony w celu powszechnego udostępniania informacji publicznej.
uczelnią#historia#i#tradycja# 31 maja 1913 r. cesarz Franciszek Józef I zatwierdził utworzenie wyższej szkoły górniczej w Krakowie. Fakt ten poprzedził długi ciąg starań o powołanie akademii, która miałaby kształcić inżynierów górników  i hutników. 
uczelnią#historia#i#tradycja#historia#agh# 31 maja 1913 r. cesarz Franciszek Józef I zatwierdził utworzenie wyższej szkoły górniczej w Krakowie. Fakt ten poprzedził długi ciąg starań o powołanie akademii, która miałaby kształcić inżynierów górników i hutników.  W 1912 r. grupa wybitnych inżynierów i działaczy górniczych pod przewodnictwem Jana Zarańskiego wszczęła zabiegi o zgodę na powołanie w Krakowie wyższej uczelni kształcącej inżynierów górnictwa. Starania te zostały zwieńczone powodzeniem i w 1913 roku Ministerstwo Robót Publicznych w Wiedniu powołało Komitet Organizacyjny Akademii Górniczej, którego przewodniczącym został profesor Józef Morozewicz.  15 czerwca 1923 r. położono kamień węgielny pod budowę przyszłego gmachu Akademii Górniczej. Dwa lata później powstał projekt godła Akademii Górniczej (zachowany w Muzeum Historii AGH) sygnowany monogramem B.T. – Bogdan Treter, prawdopodobnie zatwierdzony przez Zebranie Ogólne Profesorów. 14 grudnia 1981 r. społeczność akademicka AGH pod sztandarem „Solidarności” odważyła się zaprotestować przeciwko stłumieniu – wprowadzeniem stanu wojennego – wywalczonego poczucia wolności i solidarności. NSZZ „Solidarność” AGH był organizacją uczelnianą, jedyną w Krakowie i jedną z trzech w kraju, które zorganizowały strajki okupacyjne w pierwszych dniach stanu wojennego.
uczelnią#historia#i#tradycja#historia#agh#powołanie#ag# 31 maja 1913 r. cesarz Franciszek Józef zatwierdził utworzenie wyższej szkoły górniczej w Krakowie. Fakt ten poprzedził długi ciąg starań o powołanie akademii, która miałaby kształcić inżynierów górników i hutników. W XIX wieku zwanym „wiekiem węgla i stali” Europa budowała zręby nowoczesnych państw. Najważniejszą cechą modernizujących się społeczeństw Zachodu była postępująca industrializacja. Brak państwowości od końca XVIII wieku miał ogromne znaczenie dla rozwoju gospodarczego i społecznego Polski. Kiedy w Europie Zachodniej kształtowała się gospodarka kapitalistyczna oraz struktury nowoczesnego państwa, ziemie polskie znajdowały się w obrębie zaborczych państw i niezależnie od poziomu ich rozwoju były obszarami peryferyjnymi. Dr hab. Anna Siwik, prof. nadzw.
uczelnią#historia#i#tradycja#historia#agh#1#inauguracja#roku#akademickiego#akademii#górniczej# Starania o utworzenie w kraju uczelni górniczej oraz powołanie odpowiedniej kadry naukowej rozpoczęły się w drugiej połowie XIX w. i nasiliły wraz z uzyskaniem przez Galicję autonomii w 1860 r. Prowadzono intensywne działania dyplomatyczne w Wiedniu, aby uzyskać przychylność rządu austriackiego. W 1912 r. grupa wybitnych inżynierów i działaczy górniczych pod przewodnictwem inż. Jana Zarańskiego wszczęła zabiegi o zgodę na powołanie w Krakowie wyższej uczelni kształcącej inżynierów górnictwa. Starania te zostały zwieńczone powodzeniem – 10 lipca 1912 r. władze Krakowa otrzymały zezwolenie na otwarcie uczelni. W kwietniu 1913 r. Ministerstwo Robót Publicznych w Wiedniu powołało Komitet Organizacyjny Akademii Górniczej w Krakowie, którego pracami kierował profesor Józef Morozewicz. Dokument zatwierdzający utworzenie wyższej szkoły górniczej w Krakowie został podpisany 31 maja 1913 r. przez cesarza Franciszka Józefa I.  Wybuch wojny światowej w 1914 r. uniemożliwił rozpoczęcie w październiku pierwszego roku akademickiego nowo otwartej uczelni. W notatce z konferencji u prezydenta miasta Krakowa Juliusza Lea widnieje dopisek w prawym dolnym rogu kartki na jednym z dokumentów:    W kwietniu 1919 r. minister Jan Łukasiewicz wystosował pisma do Naczelnika Państwa w sprawie mianowania pierwszych profesorów Akademii Górniczej. Sześciu profesorów zostało oficjalnie mianowanych przez Józefa Piłsudskiego 1 maja 1919 r. Byli to: W piśmie ministra Jana Łukasiewicza wysłanym z tej okazji do Antoniego Hoborskiego można przeczytać: W „Dzienniku Urzędowym Ministerstwa Wyznań Religijnych i Oświecenia Publicznego Rzeczypospolitej Polskiej” z 18 czerwca 1919 r. ukazały się „Postanowienia przejściowe nieobjęte statutem obowiązujące w Akademii Górniczej w Krakowie”: 20 czerwca 1919 r. Komitet Organizacyjny Akademii Górniczej w Krakowie, upoważniony przez Ministerstwo Wyznań Religijnych i Oświecenia Publicznego, rozpisał konkurs na obsadzenie od 1 kwietnia 1920 r. stanowisk naukowych w katedrach na Wydziale Górniczym, a częściowo na Wydziale Hutniczym Akademii. Od kandydatów wymagano odpowiednich kwalifikacji naukowych i pedagogicznych. W tym samym miesiącu na pierwszym posiedzeniu Wydziału Profesorów Akademii Górniczej na Dziekana Wydziału Górniczego wybrany został profesor Antoni Hoborski, a Prodziekanem został profesor Jan Stock.      Uroczystość odbyła się w auli Collegium Novum Uniwersytetu Jagiellońskiego. Józefa Piłsudskiego powitała młodzież, ustawiona w szpalerze przed udekorowanym kwiatami gmachem. U wejścia oczekiwał rektor Uniwersytetu Jagiellońskiego profesor Stanisław Estreicher, trzymając w dłoni berło królowej Jadwigi, oraz dziekani w togach. Senat, poprzedzany przez osoby niosące insygnia uniwersyteckie, wprowadził Naczelnika Państwa do szczelnie wypełnionej auli. Józef Piłsudski zasiadł na podium, przykrytym na tę uroczystość XVI-wiecznym perskim dywanem. Obok niego zajęli miejsca: generał Józef Haller, minister spraw wojskowych generał Józef Leśniewski, minister wyznań religijnych i oświecenia publicznego Jan Łukasiewicz, minister przemysłu i handlu Ignacy Szczeniowski, a także inni dostojnicy państwowi. W ławach zasiedli profesorowie, na krzesłach – przedstawiciele nauki, kultury i sztuki, przemysłu, finansów, duchowieństwo, władze Krakowa. Rektor Uniwersytetu Jagiellońskiego wstąpił na katedrę i wygłosił mowę powitalną. Następnie Józef Piłsudski, posługując się orlim piórem, dokonał wpisu do Księgi Honorowej Uniwersytetu Jagiellońskiego, zwanej Królewską, która jest przechowywana w Bibliotece Jagiellońskiej. Na winiecie pergaminowej karty z autografem Piłsudskiego widnieje sygnowana i datowana na 20 października 1919 r. grafika Henryka Uziembły, wówczas porucznika Wojska Polskiego, przedstawiająca grupę żołnierzy legionowych z piechoty i kawalerii w obramowaniu zdobionym herbami: orła legionowego z koroną (u góry), Uniwersytetu Jagiellońskiego i Krakowa (po bokach) oraz herbem Piłsudskich – Kościesza (na dole). Po dokonaniu wpisu do księgi przemówił przedstawiciel młodzieży, a następnie rektor Uniwersytetu Jagiellońskiego, który wyraził radość z faktu, że do grona wyższych uczelni Krakowa dołącza Akademia Górnicza. Zapewnił o stałej życzliwości i chęci służenia jej pomocą ze strony Jagiellońskiej Wszechnicy.  Po tych przemówieniach Józef Piłsudski powstał i zwracając się do profesora Estreichera, powiedział: Głos zabrali następnie ministrowie. Minister wyznań religijnych i oświecenia publicznego Jan Łukasiewicz uzasadnił potrzebę założenia Akademii Górniczej w Krakowie, a zwracając się do przyszłych inżynierów górniczych, podkreślił, że ich obowiązkiem będzie nie tylko wydobywać z wnętrza Ziemi skarby kopalne, ale z własnego duchowego wnętrza te wszystkie walory, które cechują wzorowego obywatela kraju. Minister przemysłu i handlu Ignacy Szczeniowski podkreślił, że polski przemysł łączy duże nadzieje z działalnością Akademii Górniczej.  Po przemówieniach ministrów Naczelnik Państwa wraz z innymi osobistościami opuścił aulę uniwersytecką. Towarzyszyli mu: prymas biskup Edmund Dalbor, honorowy kapelan I Brygady Legionów ks. Władysław Bandurski, biskup polowy Wojska Polskiego ks. Stanisław Gall, generał Józef Dowbor-Muśnicki, szef Francuskiej Misji Wojskowej w Polsce Paul Prosper Henrys, prezydent Krakowa Jan Kanty Federowicz, biskup Adam Sapieha oraz przedstawiciele miejscowych władz wojskowych.  W dalszej części uroczystości z przemówieniem wystąpił przewodniczący Komitetu Organizacyjnego Akademii profesor Józef Morozewicz. Po powitaniu przybyłych gości przedstawił zarys historii rozwoju górnictwa i szkolnictwa zawodowego w Polsce i na świecie, wspominając m.in. o szkołach górniczych w Królestwie Kongresowym, Galicji czy o „szkole sztygarów” w Dąbrowie na Śląsku Austriackim. Zrelacjonował przebieg wieloletnich starań o utworzenie polskiej uczelni górniczej w Krakowie. Szczegółowo przedstawił także działania powołanego wiosną 1913 r. Komitetu Organizacyjnego, którego prace przerwał wybuch wojny: Profesor Józef Morozewicz mówił o projekcie budowy gmachu, planie studiów, kadrze naukowej. Zwrócił się także do przedstawicieli rządu o wydatną pomoc w budowie gmachu Akademii. Przemówienie zakończył słowami: Po wystąpieniu przewodniczącego Komitetu Organizacyjnego w imieniu Związku Górników i Hutników Polskich przemówił inż. Jan Zarański. Przypominając wieloletnią historię starań o utworzenie polskiej szkoły górniczej oraz podkreślając konieczność jej powstania, mówił m.in.:   Następnie Dziekan Wydziału Górniczego profesor Antoni Hoborski zaapelował do prasy o poparcie uczelni w jej dalszych pracach i wezwał młodzież do gorliwej pracy nad dźwignięciem przemysłu górniczego w kraju. Okolicznościowe mowy wygłosili m.in.: przedstawiciele Politechniki Lwowskiej – rektor profesor Maksymilian Matakiewicz i profesor Leon Syroczyński, Politechniki Warszawskiej – profesor Bronisław Rydzewski, Uniwersytetu Warszawskiego – profesor Stefan Mazurkiewicz, Uniwersytetu Lubelskiego – ks. profesor Aleksander Wóycicki, Towarzystwa Politechnicznego we Lwowie – profesor Stanisław Kontkiewicz. Nestor polskich górników inż. Hieronim Kondratowicz w serdecznych słowach witał nowy przybytek wiedzy górniczej i życzył młodemu pokoleniu próbującemu sił w zawodzie górniczym pomyślnej przyszłości. Ostatnim z mówców był słuchacz Akademii Górniczej Władysław Micheyda, który zwrócił się do Komitetu Organizacyjnego i jego przewodniczącego profesora Morozewicza oraz do grona profesorów, wyrażając radość z możliwości kształcenia się we własnym kraju.  Uroczystość zakończono odczytaniem listów gratulacyjnych od rektorów i senatów szkół wyższych w Polsce oraz depeszy wystosowanej przez rząd Rzeczypospolitej Polskiej i podpisanej przez Ignacego Paderewskiego, który pisał: W pismach gratulacyjnych nadesłanych do Akademii Górniczej przebija radość i duma z powodu otwarcia uczelni w Krakowie. Jedno z nich, datowane na 23 października 1919 r., przesłało Ministerstwo Wyznań Religijnych i Oświecenia Publicznego: Kraków długo jeszcze żył podniosłą uroczystością, a o jej przebiegu szeroko rozpisywała się prasa. Informacje i sprawozdania z uroczystości otwarcia Akademii Górniczej zamieściły gazety wychodzące w Krakowie: „Czas”, „Goniec Krakowski”, „Ilustrowany Kurier Codzienny”, „Naprzód”.  8 listopada 1919 r. profesorowie Antoni Hoborski, Stefan Kreutz oraz Jan Stock przesłali podziękowania dla Józefa Piłsudskiego: O fundamentach, na których wyrosła uczelnia, ogromnych nadziejach, jakie od samego początku w niej pokładano, a także tradycjach i spełnianej od 99 lat misji, przypominają nam teraz zapisane w Statucie Akademii Górniczo-Hutniczej słowa: Opracowanie – Katarzyna Wrzoszczyk, Dział Informacji i Promocji AGH – na podstawie:
