en#doktoranci#doctoral#schools#agh#doctoral#school#terms#and#conditions#of#admissions# 1. Admissions to the AGH Doctoral School, hereinafter referred to as the School, are open once a year, in the period immediately preceding the beginning of the winter semester. 1. Research topics can be submitted by persons authorised to exercise scientific supervision over candidates’ work toward doctoral dissertation in accordance with the provisions of Section 190 of the Higher Education and Science Law Act of 20 July 2018 (as further amended), hereinafter referred to as the Act. 1. Doctoral School candidates shall submit, by the deadline set out in the Admissions Calendar, the following documents: 1. Candidates are enrolled in the School by the Doctoral School Director based on the ranking, provided the Candidate has met all formal requirements, subject to admission limits prescribed for particular units. Candidates who have failed the qualifying examination in the leading discipline will not be enrolled in the Doctoral School. Candidates who have passed the qualifying exam in the leading discipline but were not enrolled in the Doctoral School due to lack of available places within the admission limit offered by the unit they have applied to will be entered on a waiting list. Waiting lists are created based on rankings for each unit or discipline (if applicable). Doctoral programme candidates who are not Polish citizens and who have satisfied official requirements regarding education as set out in Section 326 of the Higher Education and Science Law Act of 20 July 2018 will be admitted in accordance with the admission procedure applicable to Polish citizens.  Candidates for doctoral programmes who do not hold the degree of magister, magister inżynier or equivalent, applying for admission to a doctoral school under Section 186 (2) of the Act may seek admission provided they have obtained approval from the Doctoral School Board acknowledging the person’s outstanding academic achievement.
en#doktoranci#doctoral#schools#agh#doctoral#school#admissions#calendar# 1. AGH UST units will submit research topics by  2. The number of places available on courses provided by the AGH Doctoral School, broken down by disciplines, with references to units designated for particular doctoral projects will be published by  3. Candidates for the AGH DS should register online between  4. Candidates for the AGH DS should submit all required documents between  5.The AGH Doctoral School Board will issue an official decision concerning opening of the  admissions procedure to AGH DS candidates applying under Section 186 (2) by  6. Qualifying exams for the AGH DS will be held on  7. Ranking lists will be published on  8. Candidates will accept offers of enrolment at the AGH DS (by submitting enrolment forms and modifying – if necessary – the choice of research topics) between  9. The list of persons enrolled at the AGH DS will be published on 
en#doktoranci#szkoły#doktorskie#agh#doctoral#school#exam#topics#automation#and#electronic#and#electrical#engineering#eeacsbe#" Methodology for designing hardware and software real-time vision systems, discussion and comparison of modern computing platforms: CPU, GPU, embedded GPU, FPGA, ASIC, heterogeneous solutions, classic machine learning algorithms: regression, SVM, decision trees, k-NN, k -MEANS, GMM models, PCA, naive Bayes classifier, selected image analysis algorithm and their hardware implementations: segmentation of foreground objects, optical flow, stereovision, detection of characteristic points, tracking, quality and performance evaluation methods of perception algorithms in vision, radar and lidar systems, The concept, methods and applications of multi-domain sensor data fusion, that is, data fusion from various sources, Deep learning: networks architecture (""classic"" and convolutions), learning (algorithm and methodology), example applications, the concept of reinforcement learning in planning tasks for robotic systems with a high degree of automation. The use of deep neural networks in a computer vision and in the detection of anomalies in diagnostic systems.Parameters describing static and dynamic aspects of big data sets used in the machine learning process for the environment perception in autonomous vehicles Optimization problem of neural network structures in the context of their efficient implementation in real-time systems. The concept of explainable artificial intelligence and interpretable machine learning in the context of the design of autonomous safety critical systems. Autonomous vehicles: SAE classification, used sensors, necessary functionalities, Driver assistance systems - discussion of selected functionalities and example algorithmic solutions. Trajectory planning problem and idea of solving it for a vehicle moving in autonomous mode with a defined start and end point. Automatic control and robotics: dynamic system, stability, stabilization methods, static and dynamic properties of open and closed control systems, parametric optimization, kinematics and dynamics of industrial robots, autonomous robot path planning. Real-time control, digital controller design, implementation of digital regulator in an industrial controller and in any kind of digital programmable device.  Basic semiconductor devices: diode, unipolar and bipolar transistor, MOS transistor, thyristor, IGBT. The principle of operation, models, characteristics. Analog circuits: single and double-transistor amplifiers. Current and voltage sources based on transistors. Amplifiers with active load. Darlington systems and cascades. Differential amplifier. Power amplifiers. Internal structure of operational amplifiers. Frequency response of amplifiers. The theory of feedback. Generators. PLL. Stability criteria. Noise. RF circuits. Digital circuits: Switching transistors. Inverter, Construction of static and dynamic gates. FPGA circuits. Multiplexers. Systems of sequential logic. Registers. Counters. Semiconductor memories. Arithmetic systems. Parasitic elements in digital circuits. Synchronization. Internal structure of the microprocessor. Modeling of the system: behavioral models, synthesized models. Hardware description languages. Simulation and design of VLSI circuits: Environment and simulation of electronic circuits, types of analyzes, methods of designing. CMOS technology, scaling. Rules for drawing a plan for integrated circuit masks. Verification of the integrated circuit mask plan, simulations including parasitic elements. Simulations including technological scattering. Design of digital blocks. Testing pf integrated circuits. Analog-to-digital and digital-to-analog conversion: converters architectures and their parameters. Voltage comparators. Control and measurement systems. Methods of designing control and measurement systems. Measurement cards and their parameters. Analysis of measurement data. Sensor technology. Types of sensors, their parameters and applications. MEMS technology. Theory of signals. Fourier series. Fourier transfom. Laplace transformation. Modulation. Sampling. Discrete Fourier transform. Z transfom. Filtration. CAD tools in the design of electronic circuits. Radio communication. Wireless techniques and systems. Microwave technology. Optical communication and fiber-optic networks. Architecture of computer systems. Operating systems - basic issues. Computer Networks Basic laws and methods of electric circuit theory. Linear and nonlinear systems. Systems with fixed and distributed elements. Stationary and non-stationary systems. DC and AC circuits – calculations and measurements, Transients in electrical circuits, Power theories in electrical circuits. Measurements of power, energy, impedance, voltage, current. Maxwell equations, elements of field theory, Materials used in electrical engineering; properties of conductive materials, dielectrics, magnetic materials, semiconductors and superconductors, Insulation systems for electrical devices – materials, structures, diagnostic methods. Generation of electricity – conventional and unconventional energy sources, dispersed generation.Transmission, distribution and use of electricity, reduction of energy losses in electricity networks. Smart grids – concept, methods, challenges. Quality and reliability of electricity supply. Directions and problems in the development of power systems. E-mobility – problems and challenges. Basic semiconductor devices: diode, bipolar transistor, MOS transistor, thyristor, IGBT. Power electronics systems: AC / DC, DC / DC, AC / AC. Power-electronic interfaces in renewable energy sources. Machines and electric drives: DC, AC. Building automation."
en#doktoranci#szkoły#doktorskie#agh#doctoral#school#exam#topics#biomedical#engineering# Concepts of: biocybernetic model, simulation of biological system and examples of their application to selected problems of biology and medicine. The role of biocybernetics and biomedical engineering in progress of technology, biology and medical sciences as well as civilization achievements.  Backgrounds of theoretical neurocybernetics, goals and methods of brain modeling, various types of artificial neural networks with applications, basics of cognition sciences. Models of biological and technical perception systems (auditory and visual systems in human), regulatory systems (the concept of homeostasis and structure of management systems), and control systems (control and coordination of motor system, control with the gamma loop, cooperation of synergic and antagonist muscles). Population models.  Selected issues of artificial intelligence in biomedical applications. Knowledge representation methods. Concepts of incomplete and tentative knowledge. Expert systems. Inference rules in systems with rule-based representation of knowledge. Fuzzy logic, evolutionary algorithms. Biomedical engineering systems and applications for diagnostics, therapy, rehabilitation and prosthetics of various organs and body parts – examples and general design rules. Computer methods for biomedical signal processing and methods for automated analysis and image recognition.  Methods applied in biological and physiological measurements, monitoring of blood circulation, muscle stress, fetal wellbeing, brain function, visual and auditory perception. Examples of digital supportive tools for signal and image-based diagnostics. Multidimensional and multimodal signals. Computer methods for feature extraction and objects / events classification. Methods of surveillance of human in daily living activities (assisted living), ordination and particular characteristics of sensors. Sensor networks. Data security and privacy-related problems in physiological measurement and data transmission. Hospital information systems, therapy planning automatic and telematic triage. Problems of telemedicine: data secyrity and reliability, seamless data access, aspects of mobility and energetic efficiency of equipment. Brain-Computer Interfaces: paradigms and particular characteristics of BCIs. 
en#doktoranci#szkoły#doktorskie#agh#doctoral#school#exam#topics#civil#engineering#and#transport#ggep#  Role and tasks of mining geodesy in the functioning of mining plants. The role of mining maps in solving measurement issues, in deposit management and in mining planning. Ranges and methods of geodetic measurements for deep-sea mining plants. Surveying services in opencast mining plants. Main facilities and facilities of underground mining plants that require geodetic implementation and inventory measurements. Situational and altitude orientation of underground mines. The problem of protective pillars. Evaluation of the possibility of increasing the accuracy of forecasting. The influence of the kinematics of exploitation on the terrain surface. Geographic information systems for the purposes of hazard analysis. Deformation of the terrain surface resulting from the dehydration of the rock mass by mining exploitation. 
en#doktoranci#szkoły#doktorskie#agh#doctoral#school#exam#topics#chemical#engineering#msc#  a. thermodynamic description of a condensed system;   b. the phase rule and phase diagrams;   c. the concept of entropy in solids;   a. chemical bonds vs. material properties;  b. isomorphism and polymorphism;  a. mechanisms of heat transport in solid bodies;   b. correlation between heat transport and chemical bonds;   c. chemical diffusion and interdiffusion;   d. quantitative description of diffusion process;   a. elements of microstructure and their mutual correlations;   b. influence of grain size and porosity level on mechanical properties of ceramic materials;   c. quantitative description of microstructure elements;   d. a model of grain boundaries;   a. investigation methods of crystalline and amorphous bodies;   b. methods of investigation of thermal properties of solids;   d. methods of investigation of solid surfaces;  e. methods of investigation of solids microstructure;  a. methods of powders preparation;   b. energy balance of grinding process;   c. methods of powders granulation;   d. modes of the sintering process;   a. basics of the technology of fired ceramic building materials (plastic deformation molding and semi-dry molding methods);   b. technological additives - types and their role;  c. general characteristics of building binding materials – air-hardening binders, hydraulic binders;  d. concrete - granular composite, shrinkage of concrete and types of its corrosion  a. general characteristics of raw siliceous, clayey and carbonate raw materials;   b. transformations occurring in clay minerals during heating;   c. the role of individual raw material components of porcelain mass; 
en#doktoranci#doctoral#schools#agh#doctoral#school#research#topics#automation#and#electronic#and#electrical#engineering# self-learning algorithm, thanks to which robot will be able to quickly adapt to new tasks, vision algorithm for object inspection, thank to which it will be possible to use universal gripper. Proposed approach has the potential to significant improve current production lines. In comparison to existing solution, it allows to quickly adapt to new product, as well as the use of universal mechanisms.  The proposed topic is covered by the scope of the research project founded by National Science Centre in the OPUS programme.   The project author is a member of group having constant access to both the software for ASIC design (Cadence and Mentor packages) and laboratory for integrated circuit testing including:   The drain-source voltage of GaN transistors is limited to 650V. To achieve converter for higher voltage a multilevel topology can be applied. In a multilevel converter voltage stresses on semiconductor switches are decreased in relation to converted voltages. It is achieved in more complex topologies with higher number of switches in relation to classic converters.  high performance computing clusters capable of processing large databases of real-world perception data and building large-scale machine learning models, simulators capable of real-time generation of artificial data such as dynamic and static environment models, test vehicles equipped with full set of automotive sensors such as automotive radars, lidar sensors and vision cameras, access to large knowledge base build on many years of experience in automotive perception systems and ADAS algorithms. Described research problem fits into Aptiv’s long-term strategy, which focuses on increasing of capabilities in areas of driving automation systems and providing reliable driver assistance solutions. static one, used for factory calibration of a stationary vehicle sensor, dynamic one, used for auto-calibration for a vehicle in motion. The starting point of the work is the technology used by the company (patent EP 3 279 683 A1, Schiffmann J., Liu Y., Schwartz D., Zhu X.) and available publications (Multipath of flat plate radar cross section measurements, 2003 Proceedings of the International Conference on Radar).    Machine learning is a technology that requires expertise in the preparation of data for training and testing. The implementation of the work will develop algorithms for intelligent control of the production process. The prepared algorithms will be used to test the operation of the production system, as well as to monitor it and adjust to the changing conditions of its operation.  The technology line in which the laboratory is equipped fully replicates the technology lines currently used in smart factories. Multi-layered capabilities, both in the horizontal and vertical control hierarchy, are implemented in research and didactical work on many hardware platforms. The systems in which the laboratory is equipped include:   Research is carried on active and semi-active structures using electrohydraulic, electro-pneumatic and electrodynamic elements and assemblies. The laboratory is equipped to specialized research rigs with PAC control systems and field-programmable gate arrays FPGA. They are used to test dynamic systems and structures. The operation of the test rigs is based on electrohydraulic vibration generators made based on original designs. In addition, the laboratory is equipped with a number of measurement systems with sensors and transducers for signals acquisition. The laboratory is equipped with SUV wheeled vehicles, which are autonomous platforms designed for experimental research.    Research is carried on active and semiactive structures using electrohydraulic, electro-pneumatic and electrodynamic elements and assemblies. Supervisor: dr hab. inż. Krzysztof Wincza, prof. AGH    The main goal of the project is to research the possibility of coupled-line sections’ design that have good return losses and good isolation properties, and at the same time feature the required coupling between excited and coupled lines. In general coupled-line geometries that will be considered within the project can be complex, consisting of a number of appropriately inter-connected conductors in inhomogeneous dielectric medium. The problem of such coupled-line section realization has been research and experimentally investigated in the techniques of strip-transmission lines for both geometrically symmetrical and asymmetrical conductors. It has been shown that the principal condition of ideal coupled-line section realization to be fulfilled in the case symmetrical conductors is the equalization of phase velocities of the waves propagating in the structure. Alternatively, it can be formulated as the equalization of effective dielectric constants for coupled line geometry under even and odd excitations. The more general condition for ideal coupled-line realization has been derived for the case of geometrically asymmetrical conductors for which it is required that the capacitive and inductive coupling coefficients are equalized. Additionally, in both cases an additional impedance condition needs to be fulfilled to obtain good return losses measured for the assumed reference impedance. The project aims at developing methods for the design of coupled lines which allow to equalize capacitive and inductive coupling coefficients under the limitations specified by the chosen monolithic technology.        The research work will be performed within the research tasks of the First TEAM project entitled „Audio Processing Using Distributed Acoustic Sensors” financed by the Foundation for Polish Science, in which Dr Konrad Kowalczyk is the principle investigator. The aim of the project is to develop audio signal processing techniques which enable voice communication on distance for a person who is freely moving within the acoustic environment, based on signals recorded using distributed microphones.        
en#doktoranci#szkoły#doktorskie#agh#doctoral#school#research#topics#information#and#communication#technology# Another related topic is minimization of the number of sequential components covering a parallel system. In some cases and for some models such decompositional is evident, but in other cases – for the Petri nets, for example – multiple variants with different number of components may exist, and the problem of minimization arises. It is similar to the set cover problem, which is NP-hard in general case, hence it makes sense to design and use the corresponding approximation algorithms. On the other hand, there are cases in which the minimum cover can be found in polynomial time. So, research on the conditions of such situation and appropriate algorithms is essential. Summarizing, the interesting research problems are connected with conditions of sequential decomposition of the concurreny systems, algorithms of such decomposition, and conditions of possibility of finding the minimum cover quickly (in polynomial time).         H1: Artificial intelligence and machine learning algorithms allow identification of entities manipulating the financial report. H2: Artificial intelligence and machine learning algorithms allow identification of companies committing economic crimes. H3: Artificial intelligence and machine learning algorithms predict economic slumps and economic crises. H4: Artificial intelligence and machine learning algorithms allow to identify forms of unfair competition (for example, intentional lowering of prices below costs). H5:Artificial intelligence and machine learning algorithms (including those based on Benford law) allow the identification of entities that evade taxation. Hypotheses are going to be verified with machine learning and artificial intelligence algorithms. Asa part of the research, a comparative analysis of existing methods will be made to assess their effectiveness as well as the speed of calculations. In the further part of the study, an attempt will be made to develop existing tools to improve the efficiency and speed of existing methods.         
en#doktoranci#szkoły#doktorskie#agh#doctoral#school#research#topics#biomedical#engineering#   In addition, thanks to the established cooperation with an eminent specialist in the field of electrocardiology, prof. Marek Jastrzębski we have the opportunity to obtain unique and reliable records of electrocardiograms and to adapt computational models to solve specific problems of this branch of medicine. Current research in this area is very promising. There are three main issues currently being in the area of research interest: automatic classification of RCM images using Deep Learning methods, These studies may also be continued towards adaptation of the regular ECG storage structures and data transmission equipment to accommodate additional motion and environmental data streams. Proposal and numerical validation of the method with recorded data is expected before building and validating the hardware prototype. Evaluation with volunteers and true-to-life scenario-based experiment is necessary for validation of the solutions proposed.  These works were discontinued because a member of the team who had an apiary treated as an experimental laboratory died. There is now a reason to return to this research because a new non-standard task related to bee breeding has emerged. Well, as part of plans for the so-called terraforming of Mars (creating atmosphere, vegetation, conditions for human life), we will need to transfer insects pollinating plants to this planet - probably bees. An open problem is how bees can take a journey from Earth to Mars. The topic is worth taking as part of a doctoral thesis using your biocybernetic model.  Laboratory of Electronic Medical Apparatus  Laboratory of Medical Statistics / Laboratory of Voice Communication Systems with a Computer  Laboratory of Computer Programming / Laboratory of Telemedicine Fundamentals Laboratory of Embedded Systems and the Internet of Things
